from_name,from_entity_type,to_name,to_entity_type,from_id,to_id
Mixed Electronic Systems Manufacturing Services,RBICS_IG,Diversified Electronic Manufacturing and Services,RBICS_IG,5510151510,55101515
Circuits Assembly Services,RBICS_IG,Contract Electronic Manufacturing,RBICS_IG,5510151010,55101510
Other Defense Manufacturing,RBICS_IG,Defense Manufacturing,RBICS_IG,4010101510,40101015
Diversified Consumer Vehicle Parts Manufacturing,RBICS_IG,Consumer Vehicle Parts Manufacturing,RBICS_IG,2020101025,20201010
Electronic Interconnect Components,RBICS_IG,Interconnect Electronic Components,RBICS_IG,5510101015,55101010
Upholstery Fabrics Manufacturing,RBICS_IG,Textile Products,RBICS_IG,4520201025,45202010
Office/Institution Furniture and Accessory Makers,RBICS_IG,Home and Office Furnishings Manufacturing,RBICS_IG,5020152015,50201520
Other Design and Engineering Software,RBICS_IG,Design and Engineering Software,RBICS_IG,5520151020,55201510
Multi-Industry-Specific IT Services,RBICS_IG,Industry-Specific IT Services,RBICS_IG,5520201510,55202015
Fabricated Pipes and Pipe Fittings Products,RBICS_IG,Metal Parts and Component Manufacturing,RBICS_IG,4515101015,45151010
Diversified Semiconductors,RBICS_IG,General Semiconductors,RBICS_IG,5510202010,55102020
Food and Beverage Distributors,RBICS_IG,Retail Distributors,RBICS_IG,5010102515,50101025
Diversified Semiconductor Manufacturing Services,RBICS_IG,Semiconductor Manufacturing Services,RBICS_IG,5510301520,55103015
Touchscreen Panels Display Equipment,RBICS_IG,Hardware Components,RBICS_IG,5515203025,55152030
Corrugated Container Manufacturing,RBICS_IG,Paper Packaging Products,RBICS_IG,4520152010,45201520
"Leather, Handbags and Luggage Goods",RBICS_IG,Accessories Production,RBICS_IG,2010101015,20101010
Enterprise Middleware Software,RBICS_IG,IT Infrastructure Software,RBICS_IG,5520153525,55201535
Multi-Type Electronic Manufacturing Services,RBICS_IG,Contract Electronic Manufacturing,RBICS_IG,5510151020,55101510
RF Analog and Mixed Signal Semiconductors,RBICS_IG,Analog and Mixed Signal Semiconductors,RBICS_IG,5510201025,55102010
Water Treatment Agents Manufacturing,RBICS_IG,Cleaning and Sanitizing Agent Products,RBICS_IG,4510202520,45102025
Manufacturing Additives Manufacturing,RBICS_IG,Additives Manufacturing,RBICS_IG,4510201015,45102010
Inorganic Chemical Manufacturing,RBICS_IG,Other Commodity Chemical Manufacturing,RBICS_IG,4510101520,45101015
Diversified IT Infrastructure Software,RBICS_IG,IT Infrastructure Software,RBICS_IG,5520153520,55201535
Multi-Type Plastic Packaging Products Makers,RBICS_IG,Plastic Packaging Products,RBICS_IG,4520152510,45201525
Clay and Ceramic Products,RBICS_IG,Nonmetallic Minerals Products,RBICS_IG,4515151010,45151510
General Analog and Mixed Signal Semiconductors,RBICS_IG,Analog and Mixed Signal Semiconductors,RBICS_IG,5510201010,55102010
Other Processor Semiconductors,RBICS_IG,Processor Semiconductors,RBICS_IG,5510203030,55102030
"Power, Control and Mixed Signal Semiconductors",RBICS_IG,Analog and Mixed Signal Semiconductors,RBICS_IG,5510201020,55102010
Other Office Equipment Manufacturing,RBICS_IG,Office Equipment Products,RBICS_IG,5515103015,55151030
Other Sporting and Athletic Goods,RBICS_IG,Sporting and Athletic Goods,RBICS_IG,2010152025,20101520
Motorcycle Manufacturing,RBICS_IG,Consumer Vehicle Manufacturing,RBICS_IG,2020101520,20201015
Diversified Commodity Chemical Makers,RBICS_IG,Other Commodity Chemical Manufacturing,RBICS_IG,4510101510,45101015
Customer Premises Network Security Equipment,RBICS_IG,Wide Area Networking Equipment,RBICS_IG,5515153515,55151535
Machine Vision and Quality Control Manufacturing,RBICS_IG,Industrial Machine Parts and Support Equipment,RBICS_IG,4010202020,40102020
Household Robot Makers,RBICS_IG,Small Appliances and Accessories Manufacturing,RBICS_IG,5020101540,50201015
Security and Identification Semiconductors,RBICS_IG,Specialized Semiconductors,RBICS_IG,5510204030,55102040
Nonvolatile Memory Semiconductors,RBICS_IG,Memory Semiconductors,RBICS_IG,5510202510,55102025
Defense Training and Testing Providers,RBICS_IG,Diversified Aerospace and Defense Manufacturing,RBICS_IG,4010102015,40101020
Optoelectronics Discrete Semiconductors,RBICS_IG,Discrete Semiconductors,RBICS_IG,5510201510,55102015
Carrier Core (Backbone) Equipment,RBICS_IG,Wide Area Networking Equipment,RBICS_IG,5515153510,55151535
Other Wide Area Networking Equipment,RBICS_IG,Wide Area Networking Equipment,RBICS_IG,5515153530,55151535
"Beer, Wine and Spirits Retail",RBICS_IG,Retail Distributors,RBICS_IG,5010102510,50101025
Other Mobile Equipment,RBICS_IG,Wireless Mobile Equipment,RBICS_IG,5515154520,55151545
Ball and Roller Bearings Products,RBICS_IG,Metal Parts and Component Manufacturing,RBICS_IG,4515101010,45151010
Multimedia Semiconductors,RBICS_IG,Specialized Semiconductors,RBICS_IG,5510204015,55102040
Other Specialized Semiconductors,RBICS_IG,Specialized Semiconductors,RBICS_IG,5510204020,55102040
Multi-Type Containers and Packaging Makers,RBICS_IG,Other Containers and Packaging Products,RBICS_IG,4520151515,45201515
Tobacco Product Retail,RBICS_IG,Retail Distributors,RBICS_IG,5010102530,50101025
Printing and Imaging Peripherals,RBICS_IG,Computer Peripherals,RBICS_IG,5515201035,55152010
Natural Resource/Construction Machinery Products,RBICS_IG,Natural Resource and Construction Machinery Makers,RBICS_IG,4010202530,40102025
Securities Exchanges and ECNs,RBICS_IG,Securities Sales and Trading Services,RBICS_IG,3020102525,30201025
General Carrier Edge and Access Equipment,RBICS_IG,Wide Area Networking Equipment,RBICS_IG,5515153520,55151535
"Europe, Middle East and Africa Wireline Services",RBICS_IG,Wireline Services,RBICS_IG,6010151520,60101515
Plumbing Fixtures and Trim Manufacturing,RBICS_IG,Small Appliances and Accessories Manufacturing,RBICS_IG,5020101535,50201015
Television Cable and Broadcast Networks,RBICS_IG,Entertainment and Programming Providers,RBICS_IG,1515101515,15151015
Other Computer Systems,RBICS_IG,Computer Systems,RBICS_IG,5515201520,55152015
Other Passive Electronic Components,RBICS_IG,Passive Electronic Components,RBICS_IG,5510102525,55101025
Engineered Rubber Products,RBICS_IG,Other Plastic and Rubber Products Manufacturing,RBICS_IG,4510251010,45102510
Cable Interconnect Components,RBICS_IG,Interconnect Electronic Components,RBICS_IG,5510101010,55101010
Proprietary Trading,RBICS_IG,Securities Sales and Trading Services,RBICS_IG,3020102520,30201025
Other Respiratory System Biopharmaceuticals,RBICS_IG,Respiratory System Biopharmaceuticals,RBICS_IG,3510206015,35102060
General Communications Equipment,RBICS_IG,Other Communications Equipment,RBICS_IG,5515152510,55151525
Wireline Equipment,RBICS_IG,Local Area Networking Equipment,RBICS_IG,5515152020,55151520
General Customer Premises Equipment,RBICS_IG,Wide Area Networking Equipment,RBICS_IG,5515153525,55151535
General Electronics Distributors,RBICS_IG,Other IT Distributors,RBICS_IG,5515301515,55153015
General Scientific Products,RBICS_IG,Scientific Products,RBICS_IG,3515202515,35152025
Diversified Electrical and Power System Makers,RBICS_IG,Other Electrical Equipment/Power Systems Makers,RBICS_IG,4010151510,40101515
Heart Disorders Biopharmaceuticals,RBICS_IG,Cardiovascular System Biopharmaceuticals,RBICS_IG,3510201015,35102010
Fixed Microwave Systems Equipment,RBICS_IG,Wireless Core Infrastructure Equipment,RBICS_IG,5515154015,55151540
"Europe, Middle East and Africa Wireless Services",RBICS_IG,Wireless Services,RBICS_IG,6010151020,60101510
Europe Banks,RBICS_IG,"Europe, Middle East and Africa Banks",RBICS_IG,3010102015,30101020
Other Securities Sales and Trading Services,RBICS_IG,Securities Sales and Trading Services,RBICS_IG,3020102515,30201025
Operating Systems Software,RBICS_IG,IT Infrastructure Software,RBICS_IG,5520153535,55201535
Australia and New Zealand Banks,RBICS_IG,Asia/Pacific Banks,RBICS_IG,3010101510,30101015
Jewelry Stores,RBICS_IG,Accessories Retail,RBICS_IG,2025101015,20251010
Other Endocrinology/Metabolism Biopharmaceuticals,RBICS_IG,Endocrinology and Metabolism Biopharmaceuticals,RBICS_IG,3510202520,35102025
Global Positioning Systems (GPS) Manufacturing,RBICS_IG,Satellite Equipment,RBICS_IG,5515153015,55151530
Folding Carton Manufacturing,RBICS_IG,Paper Packaging Products,RBICS_IG,4520152015,45201520
Peripheral and Other Commerce Equipment Makers,RBICS_IG,Commerce Equipment,RBICS_IG,5515101010,55151010
Preclinical Limited Service CRO,RBICS_IG,Contract Research Organizations,RBICS_IG,3515251530,35152515
Clinical Limited Service CRO,RBICS_IG,Contract Research Organizations,RBICS_IG,3515251515,35152515
Asia/Pacific Petroleum Refineries,RBICS_IG,Petroleum Refineries,RBICS_IG,2515101515,25151015
Multi-Type Business and Personal Systems,RBICS_IG,Computer Systems,RBICS_IG,5515201515,55152015
Passive Capacitor Electronic Components,RBICS_IG,Passive Electronic Components,RBICS_IG,5510102530,55101025
Radio Frequency/Microwave Passive Electronic Parts,RBICS_IG,Passive Electronic Components,RBICS_IG,5510102535,55101025
Radio Communication Equipment,RBICS_IG,Wireless Mobile Equipment,RBICS_IG,5515154525,55151545
Diversified Technology Hardware,RBICS_IG,General Computer Hardware,RBICS_IG,5515202515,55152025
Cellular Phone Accessories Manufacturing,RBICS_IG,Wireless Mobile Equipment,RBICS_IG,5515154510,55151545
Other Programmable Logic and ASIC Semiconductors,RBICS_IG,Programmable Logic and ASIC Semiconductors,RBICS_IG,5510203510,55102035
Server Computer Systems,RBICS_IG,Computer Systems,RBICS_IG,5515201530,55152015
Industrial Glass Products Manufacturing,RBICS_IG,Nonmetallic Minerals Products,RBICS_IG,4515151020,45151510
Other Nonmetallic Minerals Mining,RBICS_IG,Nonmetallic Mineral Mining,RBICS_IG,4515301525,45153015
Latin America Banks,RBICS_IG,Americas Banks,RBICS_IG,3010101015,30101010
Government Managed Care,RBICS_IG,Health Plan Providers,RBICS_IG,3515101010,35151010
Other Healthcare Administrative Services,RBICS_IG,Healthcare Administrative Support Services,RBICS_IG,3515101520,35151015
General Communications Services,RBICS_IG,Telecommunications Industry Software and Services,RBICS_IG,6010104010,60101040
Diversified Paper and Paper Products Manufacturing,RBICS_IG,Paper and Paper Products,RBICS_IG,4520102010,45201020
Other Tobacco Products Makers,RBICS_IG,Other Tobacco Product Makers,RBICS_IG,5015202010,50152020
Consumer Vehicle Wheels and Tires Manufacturing,RBICS_IG,Consumer Vehicle Parts Manufacturing,RBICS_IG,2020101020,20201010
Smart Phone Manufacturing,RBICS_IG,Wireless Mobile Equipment,RBICS_IG,5515154530,55151545
Travel Publishers,RBICS_IG,Travel Arrangement and Reservation Services,RBICS_IG,1510103025,15101030
United States Natural Gas Utilities,RBICS_IG,Natural Gas Utilities,RBICS_IG,6510101515,65101015
Internet Off-Price Retail,RBICS_IG,Off-Price Retailers,RBICS_IG,5010152515,50101525
RFID Asset Tracking Equipment Manufacturing,RBICS_IG,Commerce Equipment,RBICS_IG,5515101020,55151010
Asia/Pacific Air Passenger Service Providers,RBICS_IG,Air Passenger Transportation,RBICS_IG,4015301015,40153010
Home and Office Multimedia Software,RBICS_IG,Home and Office Software,RBICS_IG,5520152520,55201525
Input/Output (I/O) Adapter and Interface Devices,RBICS_IG,Computer Peripherals,RBICS_IG,5515201025,55152010
Other Local Area Networking Equipment,RBICS_IG,Local Area Networking Equipment,RBICS_IG,5515152010,55151520
Healthcare IT Services,RBICS_IG,Other Healthcare Support Services,RBICS_IG,3515102525,35151025
Death Care Services,RBICS_IG,Personal Services,RBICS_IG,5025101510,50251015
Pituitary Gland Disorders Biopharmaceuticals,RBICS_IG,Endocrinology and Metabolism Biopharmaceuticals,RBICS_IG,3510202525,35102025
"Sand, Gravel and Rocks Mineral Mining",RBICS_IG,Nonmetallic Mineral Mining,RBICS_IG,4515301540,45153015
Integrated Steel Mills and Products Manufacturing,RBICS_IG,Primary Metals Products,RBICS_IG,4515102020,45151020
Other Industrial Plastic Products Makers,RBICS_IG,Plastic Products Manufacturing,RBICS_IG,4510251520,45102515
Other Business Communications Equipment,RBICS_IG,Business Communications Equipment,RBICS_IG,5515151020,55151510
Middle East Banks,RBICS_IG,"Europe, Middle East and Africa Banks",RBICS_IG,3010102020,30101020
General Computer Hardware Manufacturing,RBICS_IG,General Computer Hardware,RBICS_IG,5515202510,55152025
Plastic Bottle Manufacturing,RBICS_IG,Plastic Packaging Products,RBICS_IG,4520152525,45201525
Microprocessor Semiconductors,RBICS_IG,Processor Semiconductors,RBICS_IG,5510203025,55102030
Other Ambulatory and Outpatient Diagnostic Care,RBICS_IG,Ambulatory and Outpatient Diagnostic Patient Care,RBICS_IG,3515151515,35151515
"Integrated Books, Movies and Music Retail",RBICS_IG,Entertainment Retail,RBICS_IG,2025151510,20251515
Water Transportation (Ferry Service),RBICS_IG,Other Passenger Transportation,RBICS_IG,4015301525,40153015
United States Regional Electric Utilities,RBICS_IG,Electric Utilities,RBICS_IG,6510101020,65101010
Plastic Bag Manufacturing,RBICS_IG,Plastic Packaging Products,RBICS_IG,4520152520,45201525
Transdermal Delivery Devices,RBICS_IG,Drug Delivery Devices,RBICS_IG,3520101520,35201015
Other Memory Semiconductors,RBICS_IG,Memory Semiconductors,RBICS_IG,5510202515,55102025
Multi-Type Resource/Construction Machinery Makers,RBICS_IG,Natural Resource and Construction Machinery Makers,RBICS_IG,4010202515,40102025
Footwear Stores,RBICS_IG,Footwear Retail,RBICS_IG,2025102510,20251025
Diversified Semiconductor Capital Equipment,RBICS_IG,Semiconductor Manufacturing Capital Equipment,RBICS_IG,5510301025,55103010
Diverse Nonmetallic Minerals Processors,RBICS_IG,Nonmetallic Minerals Products,RBICS_IG,4515151015,45151510
Other Hospitals,RBICS_IG,Acute Care and Institutional Patient Care,RBICS_IG,3515151015,35151510
Emission Control Services and Technologies,RBICS_IG,Hazardous Materials Disposal,RBICS_IG,1010251520,10102515
Refined Petroleum Liquid Pipeline and Storage,RBICS_IG,Petroleum Liquid Pipeline and Storage,RBICS_IG,2515152020,25151520
Phosphates Mineral Mining,RBICS_IG,Nonmetallic Mineral Mining,RBICS_IG,4515301530,45153015
Fresh Fruits and Vegetables Retail,RBICS_IG,Retail Distributors,RBICS_IG,5010102520,50101025
Fasteners Manufacturing,RBICS_IG,Metal Parts and Component Manufacturing,RBICS_IG,4515101020,45151010
Check Cashing and Pawnshops,RBICS_IG,Consumer Finance Services,RBICS_IG,3030101515,30301015
Other Metal Packaging Products Makers,RBICS_IG,Metal Packaging Products,RBICS_IG,4520151015,45201510
Communications Equipment Distributors,RBICS_IG,IT Hardware Distributors,RBICS_IG,5515301010,55153010
Conferencing Equipment,RBICS_IG,Business Communications Equipment,RBICS_IG,5515151010,55151510
Infusion Therapy Devices,RBICS_IG,Drug Delivery Devices,RBICS_IG,3520101510,35201015
General Automotive Services,RBICS_IG,Automotive Services,RBICS_IG,2015101015,20151010
US Traditional Fuel Wholesale Power,RBICS_IG,United States Wholesale Power,RBICS_IG,6510103515,65101035
Other United States Electric Utilities,RBICS_IG,Electric Utilities,RBICS_IG,6510101015,65101010
Diversified Healthcare Distributors,RBICS_IG,Healthcare Distributors,RBICS_IG,3515102010,35151020
Information and Disk Storage Systems,RBICS_IG,Data Storage Hardware,RBICS_IG,5515202020,55152020
United States South and West Savings Institutions,RBICS_IG,United States Savings Institutions,RBICS_IG,3010201515,30102015
Other Construction Wood Products Makers,RBICS_IG,Construction Wood Products,RBICS_IG,4520101025,45201010
General Commercial Electronics Manufacturers,RBICS_IG,Other Commercial Electronics Manufacturing,RBICS_IG,5515103510,55151035
"Team, Individual and Other Sports Manufacturing",RBICS_IG,Sporting and Athletic Goods,RBICS_IG,2010152030,20101520
United States Wireless Services,RBICS_IG,Wireless Services,RBICS_IG,6010151030,60101510
Life and Health Reinsurance,RBICS_IG,Reinsurance,RBICS_IG,3015102510,30151025
Business Development Companies,RBICS_IG,Investment Holding Companies,RBICS_IG,3020102015,30201020
Other Core Infrastructure Equipment,RBICS_IG,Wireless Core Infrastructure Equipment,RBICS_IG,5515154020,55151540
Golf Equipment,RBICS_IG,Sporting and Athletic Goods,RBICS_IG,2010152015,20101520
Anesthesia Biopharmaceuticals,RBICS_IG,Pain Management Biopharmaceuticals,RBICS_IG,3510151510,35101515
Healthcare Staffing and Recruiting,RBICS_IG,Other Healthcare Support Services,RBICS_IG,3515102530,35151025
Other Commercial Transportation Equipment Makers,RBICS_IG,Commercial Transportation Equipment Manufacturing,RBICS_IG,4010251025,40102510
International Natural Gas Pipeline and Storage,RBICS_IG,Natural Gas Pipeline and Storage Services,RBICS_IG,2515151010,25151510
Asia/Pacific Department Stores,RBICS_IG,Department Stores,RBICS_IG,5010151015,50101510
Cellular Site Equipment,RBICS_IG,Wireless Core Infrastructure Equipment,RBICS_IG,5515154010,55151540
Tools and Outdoor Care Building Hand Tool Products,RBICS_IG,Tools and Outdoor Care Equipment,RBICS_IG,4010203525,40102035
Programmable Logic Device Semiconductors,RBICS_IG,Programmable Logic and ASIC Semiconductors,RBICS_IG,5510203515,55102035
Video Peripherals,RBICS_IG,Computer Peripherals,RBICS_IG,5515201040,55152010
Magnetic Passive Electronic Components,RBICS_IG,Passive Electronic Components,RBICS_IG,5510102515,55101025
Printed Circuit Boards,RBICS_IG,Hardware Components,RBICS_IG,5515203020,55152030
Other United States Commercial Banks,RBICS_IG,United States Commercial Banks,RBICS_IG,3010201010,30102010
Pan-Asia/Pacific Wholesale Power,RBICS_IG,Asia/Pacific Wholesale Power,RBICS_IG,6510104510,65101045
Passenger Rail Transportation,RBICS_IG,Other Passenger Transportation,RBICS_IG,4015301520,40153015
Other United States Energy Utilities,RBICS_IG,Other Electric and Natural Gas Utilities,RBICS_IG,6510102020,65101020
Video Signal Processor and Receiver Equipment,RBICS_IG,Consumer Video Electronics Equipment,RBICS_IG,5515252520,55152525
Oscillator and Piezoelectric Passive Components,RBICS_IG,Passive Electronic Components,RBICS_IG,5510102520,55101025
Multi-Type Investment Holding Companies,RBICS_IG,Investment Holding Companies,RBICS_IG,3020102020,30201020
Mixed Industrial Machinery Parts/Equipment Makers,RBICS_IG,Industrial Machine Parts and Support Equipment,RBICS_IG,4010202010,40102020
Boat Makers,RBICS_IG,Recreational Goods,RBICS_IG,2010151510,20101515
Off-Price Retail Stores,RBICS_IG,Off-Price Retailers,RBICS_IG,5010152510,50101525
Electronics Manufacturing Equipment Manufacturing,RBICS_IG,Electronics Manufacturing Equipment,RBICS_IG,5510251010,55102510
Europe Air Passenger Service Providers,RBICS_IG,Air Passenger Transportation,RBICS_IG,4015301020,40153010
Print Advertising,RBICS_IG,Print Media and Publishing Services,RBICS_IG,1515102015,15151020
Test and Measurement Communications Equipment,RBICS_IG,Test and Measurement Equipment,RBICS_IG,5515104520,55151045
General Leisure Goods,RBICS_IG,Other Leisure Goods,RBICS_IG,2010151015,20101510
Volatile Memory Semiconductors,RBICS_IG,Memory Semiconductors,RBICS_IG,5510202520,55102025
Cruise Lines,RBICS_IG,Accommodation Providers,RBICS_IG,1510101010,15101010
Lawn and Garden Care Tool Manufacturing,RBICS_IG,Tools and Outdoor Care Equipment,RBICS_IG,4010203515,40102035
Computer and Software Stores,RBICS_IG,Electronics Retail,RBICS_IG,2025151010,20251510
Rehabilitation Patient Care,RBICS_IG,Other Ambulatory and Outpatient Patient Care,RBICS_IG,3515153025,35151530
Computer Display Equipment,RBICS_IG,Computer Peripherals,RBICS_IG,5515201010,55152010
Desktop Computer Systems,RBICS_IG,Computer Systems,RBICS_IG,5515201510,55152015
General Food and Beverage Services,RBICS_IG,Other Food and Beverage Services,RBICS_IG,1510102015,15101020
Diversified Industrial Manufacturing,RBICS_IG,Other Machinery Manufacturing,RBICS_IG,4010203025,40102030
Fuse Passive Electronic Components,RBICS_IG,Passive Electronic Components,RBICS_IG,5510102510,55101025
Bus Transportation,RBICS_IG,Other Passenger Transportation,RBICS_IG,4015301510,40153015
Wastewater Residual Management,RBICS_IG,Environmental Services,RBICS_IG,1010253035,10102530
Diamond Mining,RBICS_IG,Nonmetallic Mineral Mining,RBICS_IG,4515301510,45153015
Diversified Electronic Media and Sites,RBICS_IG,Diversified Electronic Media Services,RBICS_IG,5520101510,55201015
Other Metal Products Makers,RBICS_IG,Other Metal Product Manufacturing,RBICS_IG,4515101510,45151015
Human Interface Peripherals,RBICS_IG,Computer Peripherals,RBICS_IG,5515201020,55152010
Electronic System Security Equipment,RBICS_IG,Electronic Security Equipment,RBICS_IG,5515101530,55151015
"Soaps, Detergents and Biocides Manufacturing",RBICS_IG,Cleaning and Sanitizing Agent Products,RBICS_IG,4510202515,45102025
Logging and Timber Property Management,RBICS_IG,Other Forestry and Paper Products Manufacturing,RBICS_IG,4520101515,45201015
Russia/CIS/FSU Fossil Fuel Exploration/Production,RBICS_IG,Other Fossil Fuel Exploration and Production,RBICS_IG,2510152030,25101520
Diversified Crop Production,RBICS_IG,Crop Production,RBICS_IG,5015101525,50151015
Data Storage Media,RBICS_IG,Data Storage Hardware,RBICS_IG,5515202015,55152020
Computer Hardware and Storage Distributors,RBICS_IG,IT Hardware Distributors,RBICS_IG,5515301015,55153010
Other Immunology Biopharmaceuticals,RBICS_IG,Immunology Biopharmaceuticals,RBICS_IG,3510203520,35102035
Asia Excluding China Mixed Telecommunications,RBICS_IG,Pan-Asia/Pacific Mixed Telecommunications Services,RBICS_IG,6010105520,60101055
Western Europe Mixed Telecommunications Services,RBICS_IG,Pan-Europe Mixed Telecommunications Services,RBICS_IG,6010106015,60101060
Personal Recreation Vehicle Manufacturing,RBICS_IG,Recreational Goods,RBICS_IG,2010151515,20101515
Multi-Region Air Passenger Transportation,RBICS_IG,Air Passenger Transportation,RBICS_IG,4015301025,40153010
General Motor Vehicles and Parts Retail,RBICS_IG,Motor Vehicles and Parts Sales and Rental,RBICS_IG,2015102020,20151020
Other Test and Measurement Equipment,RBICS_IG,Test and Measurement Equipment,RBICS_IG,5515104515,55151045
Flexible Circuit Manufacturing,RBICS_IG,Interconnect Fabrication,RBICS_IG,5510152010,55101520
Diversified Primary Metals Processors,RBICS_IG,Primary Metals Products,RBICS_IG,4515102015,45151020
Multinational Fossil Fuel Exploration/Production,RBICS_IG,Other Fossil Fuel Exploration and Production,RBICS_IG,2510152025,25101520
Middle East and Africa Petroleum Refineries,RBICS_IG,Petroleum Refineries,RBICS_IG,2515101525,25151015
Limestone and Granite Mining,RBICS_IG,Nonmetallic Mineral Mining,RBICS_IG,4515301520,45153015
Multi-Type Plastic Products Manufacturing,RBICS_IG,Plastic Products Manufacturing,RBICS_IG,4510251515,45102515
Internet Warehouse / Superstore Retail,RBICS_IG,Warehouse Clubs and Superstores,RBICS_IG,5010153015,50101530
Canada Wholesale Power,RBICS_IG,Americas Wholesale Power,RBICS_IG,6510104015,65101040
Other Steel Mills and Products Manufacturing,RBICS_IG,Other Metal Product Manufacturing,RBICS_IG,4515101515,45151015
Mixed Usage Travel Arrangement and Reservation,RBICS_IG,Travel Arrangement and Reservation Services,RBICS_IG,1510103010,15101030
Conventional Flat Panel Display Equipment,RBICS_IG,Hardware Components,RBICS_IG,5515203010,55152030
Central and Eastern Europe Mixed Telecom Services,RBICS_IG,Pan-Europe Mixed Telecommunications Services,RBICS_IG,6010106020,60101060
Clinical and Preclinical Limited Service CRO,RBICS_IG,Contract Research Organizations,RBICS_IG,3515251510,35152515
Americas (Excluding US) Department Stores,RBICS_IG,Department Stores,RBICS_IG,5010151010,50101510
Diversified Forestry and Paper Product Makers,RBICS_IG,Other Forestry and Paper Products Manufacturing,RBICS_IG,4520101510,45201015
Other Household Products Manufacturing,RBICS_IG,Small Appliances and Accessories Manufacturing,RBICS_IG,5020101525,50201015
Europe Petroleum Refineries,RBICS_IG,Petroleum Refineries,RBICS_IG,2515101520,25151015
Pan-Americas Wholesale Power,RBICS_IG,Americas Wholesale Power,RBICS_IG,6510104010,65101040
Other Computer Display Equipment,RBICS_IG,Hardware Components,RBICS_IG,5515203015,55152030
Multi-Type Support for Oil and Gas Operations,RBICS_IG,Oil and Gas Operations Support Activities,RBICS_IG,2510202015,25102020
Luggage and Leather Goods Stores,RBICS_IG,Accessories Retail,RBICS_IG,2025101020,20251010
"Multi-Product Adhesive, Sealant and Paint Makers",RBICS_IG,"Adhesive, Sealant, Coating and Paint Products",RBICS_IG,4510201525,45102015
General Metal and Mineral Products Manufacturing,RBICS_IG,General Metal and Mineral Product Manufacturing,RBICS_IG,4515201010,45152010
Other Tools and Outdoor Care Tool Manufacturing,RBICS_IG,Tools and Outdoor Care Equipment,RBICS_IG,4010203520,40102035
Mexico Mixed Telecommunications Services,RBICS_IG,Pan-Americas Mixed Telecommunications Services,RBICS_IG,6010105025,60101050
Multinational Petroleum Refineries,RBICS_IG,Petroleum Refineries,RBICS_IG,2515101530,25151015
Oriented Strand Board (OSB) Manufacturing,RBICS_IG,Construction Wood Products,RBICS_IG,4520101020,45201010
General Plastic and Rubber Manufacturing,RBICS_IG,Other Plastic and Rubber Products Manufacturing,RBICS_IG,4510251015,45102510
Other Video Electronics Equipment,RBICS_IG,Consumer Video Electronics Equipment,RBICS_IG,5515252515,55152525
Education Finance,RBICS_IG,Consumer Finance Services,RBICS_IG,3030101525,30301015
Multi-Type Accommodation Providers,RBICS_IG,Accommodation Providers,RBICS_IG,1510101030,15101010
Diversified Cleaning and Sanitizing Agents Makers,RBICS_IG,Cleaning and Sanitizing Agent Products,RBICS_IG,4510202510,45102025
Print and Prepress Industry Software,RBICS_IG,Print Media and Publishing Services,RBICS_IG,1515102010,15151020
China Mixed Telecommunications Services,RBICS_IG,Pan-Asia/Pacific Mixed Telecommunications Services,RBICS_IG,6010105525,60101055
Europe Department Stores,RBICS_IG,Department Stores,RBICS_IG,5010151020,50101510
Multi-Type Data Storage Hardware Makers,RBICS_IG,Data Storage Hardware,RBICS_IG,5515202025,55152020
Hospitality IT Services,RBICS_IG,Accommodation Providers,RBICS_IG,1510101020,15101010
