from_name,from_entity_type,to_name,to_entity_type,from_id,to_id
Custodial Services,RBICS_IG,Other Securities Sales and Trading Services,RBICS_IG,302010251525,3020102515
Middle East and Africa Wind Wholesale Power,RBICS_IG,Middle East and Africa Wholesale Power,RBICS_IG,651010501555,6510105015
Middle East and Africa Geothermal Wholesale Power,RBICS_IG,Middle East and Africa Wholesale Power,RBICS_IG,651010501540,6510105015
Middle East and Africa Mixed Alt. Wholesale Power,RBICS_IG,Middle East and Africa Wholesale Power,RBICS_IG,651010501510,6510105015
Other Road Transportation,RBICS_IG,Road Transportation,RBICS_IG,401510201525,4015102015
Horse Racing and Intertrack Wagering Systems,RBICS_IG,Gaming Industries,RBICS_IG,151010151530,1510101515
National Electric Utilities,RBICS_IG,Other United States Electric Utilities,RBICS_IG,651010101510,6510101015
United States South Atlantic Electric Utilities,RBICS_IG,United States Regional Electric Utilities,RBICS_IG,651010102020,6510101020
General Gaming Industries,RBICS_IG,Gaming Industries,RBICS_IG,151010151520,1510101515
Mixed Office/Institutional Furniture Manufacturing,RBICS_IG,Office/Institution Furniture and Accessory Makers,RBICS_IG,502015201510,5020152015
Pan-America Wireless Services,RBICS_IG,Americas Wireless Services,RBICS_IG,601015101015,6010151010
Flash Memory Semiconductors,RBICS_IG,Nonvolatile Memory Semiconductors,RBICS_IG,551020251010,5510202510
Global Mixed TV Cable and Broadcast Networks,RBICS_IG,Television Cable and Broadcast Networks,RBICS_IG,151510151520,1515101515
Latin America Crude Oil Liquid Pipeline/Storage,RBICS_IG,Crude Oil Liquid Pipeline and Storage,RBICS_IG,251515201025,2515152010
Multi-Type Organic and Petrochemicals Makers,RBICS_IG,Petrochemicals and Alternative Fuels Manufacturing,RBICS_IG,451010101525,4510101015
China Geothermal Wholesale Power,RBICS_IG,China Wholesale Power,RBICS_IG,651010451540,6510104515
Mixed Cruise and Land-Based Accommodations,RBICS_IG,Multi-Type Accommodation Providers,RBICS_IG,151010103010,1510101030
United States Southern Commercial Banks,RBICS_IG,United States East and South Commercial Banks,RBICS_IG,301020101510,3010201015
Deli-Style and Lunch Restaurants,RBICS_IG,Limited-Service and Fast Food Restaurants,RBICS_IG,151010251530,1510102515
Pan-Europe Fossil Fuel Exploration/Production,RBICS_IG,Europe Fossil Fuel Exploration/Production,RBICS_IG,251015201520,2510152015
Pan-Asia Gold Ore Mining,RBICS_IG,Asia/Pacific Gold Mining,RBICS_IG,451525201520,4515252015
Europe Propane and LPG Marketing and Dist.,RBICS_IG,Propane and LPG Marketing and Distribution,RBICS_IG,251510103030,2515101030
Europe Petroleum Storage and Transport,RBICS_IG,Petroleum Storage and Transportation,RBICS_IG,251510102530,2515101025
United States West Electric Utilities,RBICS_IG,United States Regional Electric Utilities,RBICS_IG,651010102025,6510101020
Canada Mixed Wholesale Power,RBICS_IG,Canada Wholesale Power,RBICS_IG,651010401515,6510104015
Latin America Propane and LPG Marketing and Dist.,RBICS_IG,Propane and LPG Marketing and Distribution,RBICS_IG,251510103020,2515101030
Latin America CNG and LNG Distributors,RBICS_IG,CNG and LNG Distributors,RBICS_IG,251510101020,2515101010
South United States Savings Institutions,RBICS_IG,United States South and West Savings Institutions,RBICS_IG,301020151515,3010201515
Europe CNG and LNG Distributors,RBICS_IG,CNG and LNG Distributors,RBICS_IG,251510101030,2515101010
Acetylene Gas Manufacturing,RBICS_IG,Industrial Gas Manufacturing,RBICS_IG,451010151535,4510101515
Oxygen Gas Manufacturing,RBICS_IG,Industrial Gas Manufacturing,RBICS_IG,451010151515,4510101515
Aerospace and Defense IT Services,RBICS_IG,Other Defense Manufacturing,RBICS_IG,401010151015,4010101510
New England United States Savings Institutions,RBICS_IG,United States East Savings Institutions,RBICS_IG,301020151015,3010201510
Autonomous Drone Parts Manufacturers,RBICS_IG,Aviation Equipment,RBICS_IG,401010101045,4010101010
Mexican Restaurants,RBICS_IG,Limited-Service and Fast Food Restaurants,RBICS_IG,151010251535,1510102515
Latin America Petroleum Storage and Transport,RBICS_IG,Petroleum Storage and Transportation,RBICS_IG,251510102520,2515101025
Latin America Biomass Wholesale Power,RBICS_IG,Latin America Wholesale Power,RBICS_IG,651010402030,6510104020
Foundation and Endowment Managers,RBICS_IG,Alternative Investment Managers,RBICS_IG,302010101040,3020101010
Document Duplication Equipment and Copier Makers,RBICS_IG,Document Duplication Equipment and Copiers,RBICS_IG,551510301010,5515103010
Middle East/Africa Nat. Gas Pipeline and Storage,RBICS_IG,International Natural Gas Pipeline and Storage,RBICS_IG,251515101025,2515151010
Other US South Fossil Fuel Exploration/Production,RBICS_IG,US Southern Fossil Fuel Exploration/Production,RBICS_IG,251015102025,2510151020
Canada Hydroelectric Wholesale Power,RBICS_IG,Canada Wholesale Power,RBICS_IG,651010401545,6510104015
Other North America Gold Ore Mining,RBICS_IG,Americas Gold Mining,RBICS_IG,451525201025,4515252010
United States Class I Railroad Transportation,RBICS_IG,Rail Transportation,RBICS_IG,401510201025,4015102010
US Territories and Puerto Rico Commercial Banks,RBICS_IG,Other United States Commercial Banks,RBICS_IG,301020101015,3010201010
Canada Solar Wholesale Power,RBICS_IG,Canada Wholesale Power,RBICS_IG,651010401550,6510104015
Canada Decentralized Wholesale Power,RBICS_IG,Canada Wholesale Power,RBICS_IG,651010401535,6510104015
United States Geothermal Wholesale Power,RBICS_IG,US Other and Mixed Wholesale Power,RBICS_IG,651010351030,6510103510
Medicaid Managed Care,RBICS_IG,Government Managed Care,RBICS_IG,351510101010,3515101010
United States Short-Line Railroad Transportation,RBICS_IG,Rail Transportation,RBICS_IG,401510201030,4015102010
United States Long Distance Voice Services,RBICS_IG,United States Wireline Services,RBICS_IG,601015153020,6010151530
Uranium Fuel Manufacturing,RBICS_IG,Petrochemicals and Alternative Fuels Manufacturing,RBICS_IG,451010101540,4510101015
Canada Investment Banking and Corporate Finance,RBICS_IG,Americas Investment Banking and Corporate Finance,RBICS_IG,302010151010,3020101510
Europe Mixed Traditional Fuel Wholesale Power,RBICS_IG,Europe Wholesale Power,RBICS_IG,651010501025,6510105010
Other Asia/Pacific Mixed Trad. Wholesale Power,RBICS_IG,Other Asia/Pacific Wholesale Power,RBICS_IG,651010452025,6510104520
Other Asia/Pacific Nuclear Wholesale Power,RBICS_IG,Other Asia/Pacific Wholesale Power,RBICS_IG,651010452060,6510104520
United States South Electric Utilities,RBICS_IG,United States Regional Electric Utilities,RBICS_IG,651010102035,6510101020
United States Nuclear Wholesale Power,RBICS_IG,US Traditional Fuel Wholesale Power,RBICS_IG,651010351520,6510103515
Web Navigation Sites and Software,RBICS_IG,Web-Related Content Providers,RBICS_IG,552010351510,5520103515
Biopharmaceutical OEM,RBICS_IG,Contract Manufacturing Organizations,RBICS_IG,3515251010,35152510
Travel Agencies,RBICS_IG,Travel Arrangement and Reservation Services,RBICS_IG,1510103020,15101030
Colocation and Data Center Services,RBICS_IG,Internet Hosting Services,RBICS_IG,5520102010,55201020
"Potash, Soda and Borates Mineral Mining",RBICS_IG,Nonmetallic Mineral Mining,RBICS_IG,4515301535,45153015
Other Specialty/Performance Chemicals Products,RBICS_IG,Other Specialty/Performance Chemical Manufacturing,RBICS_IG,4510203030,45102030
Rail Transportation,RBICS_IG,Road and Rail Transportation Operators,RBICS_IG,4015102010,40151020
Leasing Services,RBICS_IG,Commercial Finance Services,RBICS_IG,3030101015,30301010
Road Transportation,RBICS_IG,Road and Rail Transportation Operators,RBICS_IG,4015102015,40151020
Crude Oil Distributors,RBICS_IG,"LPG, Propane and Other Distributors",RBICS_IG,2515101035,25151010
Americas Investment Banking and Corporate Finance,RBICS_IG,Investment Banking and Corporate Finance,RBICS_IG,3020101510,30201015
Diverse Asset Management and Financial Advisors,RBICS_IG,Asset Management and Financial Advisory Services,RBICS_IG,3020101015,30201010
Other Organic Chemical Manufacturers,RBICS_IG,Organic and Petrochemical Products,RBICS_IG,4510101010,45101010
Commercial Insurance,RBICS_IG,Property and Casualty Insurance,RBICS_IG,3015102010,30151020
Blank Check Companies/SPAC,RBICS_IG,Investment Holding Companies,RBICS_IG,3020102010,30201020
Pan-US Fossil Fuel Exploration/Production,RBICS_IG,Americas Fossil Fuel Exploration and Production,RBICS_IG,2510151015,25101510
US Southern Fossil Fuel Exploration/Production,RBICS_IG,Americas Fossil Fuel Exploration and Production,RBICS_IG,2510151020,25101510
Institutional and High-Net Advisory Services,RBICS_IG,Asset Management and Financial Advisory Services,RBICS_IG,3020101025,30201010
United States East and South Commercial Banks,RBICS_IG,United States Commercial Banks,RBICS_IG,3010201015,30102010
Non-Alcoholic Beverage Production,RBICS_IG,Beverages Production,RBICS_IG,5015151020,50151510
Latin America Wholesale Power,RBICS_IG,Americas Wholesale Power,RBICS_IG,6510104020,65101040
Private Equity and Venture Capital Companies,RBICS_IG,Investment Holding Companies,RBICS_IG,3020102025,30201020
Water Transportation,RBICS_IG,Air and Water Transportation Operators,RBICS_IG,4015101015,40151010
Specialty Metal Ore Mining,RBICS_IG,Base Metal Mining,RBICS_IG,4515251020,45152510
Consumer Content Providers,RBICS_IG,Web-Based Data and Services,RBICS_IG,5520103510,55201035
Other Marketing and Advertising Services,RBICS_IG,Marketing and Advertising Services,RBICS_IG,1010101015,10101010
Customer Relationship Management Software,RBICS_IG,Enterprise Management Software,RBICS_IG,5520151525,55201515
"Fibers, Polymers and Resins Manufacturing",RBICS_IG,Specialty/Performance Fibers and Polymer Products,RBICS_IG,4510203510,45102035
Oil and Gas Well Servicing,RBICS_IG,Oil and Gas Operations Support Activities,RBICS_IG,2510202040,25102020
Specialty Contractors,RBICS_IG,Infrastructure Construction/Contracting Services,RBICS_IG,4015251020,40152510
Internet Furniture and Home Furnishings Retail,RBICS_IG,Furniture and Home Furnishings Stores,RBICS_IG,2025201525,20252015
Furniture Stores,RBICS_IG,Furniture and Home Furnishings Stores,RBICS_IG,2025201510,20252015
Business Intelligence Software,RBICS_IG,Enterprise Management Software,RBICS_IG,5520151515,55201515
Other Aerospace Equipment Manufacturing,RBICS_IG,Aerospace Equipment,RBICS_IG,4010101015,40101010
Other Oil and Gas Support Activities,RBICS_IG,Oil and Gas Operations Support Activities,RBICS_IG,2510202050,25102020
Other Industrial Electrical Products,RBICS_IG,Commercial and Industrial Electric Products,RBICS_IG,4010151015,40101510
Inspection and Detection Systems Manufacturing,RBICS_IG,Electronic Security Equipment,RBICS_IG,5515101525,55151015
Other Specialized Medical Devices,RBICS_IG,Specialized Medical Devices,RBICS_IG,3520201510,35202015
Monitoring and Control Sensor/Instrument Products,RBICS_IG,Industrial Machine Parts and Support Equipment,RBICS_IG,4010202025,40102020
Oil and Gas Hydraulic Fracturing Services,RBICS_IG,Oil and Gas Operations Support Activities,RBICS_IG,2510202030,25102020
Industrial and Engineering Hand Tool Manufacturing,RBICS_IG,Tools and Outdoor Care Equipment,RBICS_IG,4010203510,40102035
Other Drug Delivery Devices,RBICS_IG,Drug Delivery Devices,RBICS_IG,3520101515,35201015
Other Plastic Containers/Components Manufacturing,RBICS_IG,Plastic Packaging Products,RBICS_IG,4520152515,45201525
Orthopedics Medical Devices,RBICS_IG,System-Specific General Medical Devices,RBICS_IG,3520151015,35201510
Convenience Stores,RBICS_IG,Grocery Stores,RBICS_IG,5010102010,50101020
Amusement and Recreation Centers,RBICS_IG,"Arts, Entertainment and Recreation Providers",RBICS_IG,1510101510,15101015
Enterprise Resource Planning Software,RBICS_IG,Enterprise Management Software,RBICS_IG,5520151530,55201515
Handheld and Smart Phone Software,RBICS_IG,Home and Office Software,RBICS_IG,5520152515,55201525
Electronic Transaction Processing/Clearinghouses,RBICS_IG,Consumer Finance Services,RBICS_IG,3030101530,30301015
Drug Discovery Services,RBICS_IG,Outsourced Drug Services,RBICS_IG,3515202015,35152020
Business Process Outsourcing Services,RBICS_IG,Consulting/Business Process Outsourcing Services,RBICS_IG,1010151510,10101515
Administrative Employment Services,RBICS_IG,Administrative Services,RBICS_IG,1010151010,10101510
Other Business Administrative Services,RBICS_IG,Administrative Services,RBICS_IG,1010151030,10101510
Marketing Specialists,RBICS_IG,Marketing and Advertising Services,RBICS_IG,1010101010,10101010
Commercial and Public Service Vehicles Production,RBICS_IG,Commercial Transportation Equipment Manufacturing,RBICS_IG,4010251015,40102510
Heavy Duty Trucks and Trailers Manufacturing,RBICS_IG,Commercial Transportation Equipment Manufacturing,RBICS_IG,4010251020,40102510
Chemical and Allied Products Distributors,RBICS_IG,Materials Distributors,RBICS_IG,4015201510,40152015
Other Agricultural Support Activity Providers,RBICS_IG,Agricultural Support Activity Providers,RBICS_IG,5015102510,50151025
Other Asia/Pacific Banks,RBICS_IG,Asia/Pacific Banks,RBICS_IG,3010101515,30101015
Other Asia/Pacific Wholesale Power,RBICS_IG,Asia/Pacific Wholesale Power,RBICS_IG,6510104520,65101045
Diversified General Waste Collection,RBICS_IG,General Waste Collection,RBICS_IG,1010251010,10102510
Environmental Consulting,RBICS_IG,Environmental Services,RBICS_IG,1010253015,10102530
Industry-Specific Factory Automation Equipment,RBICS_IG,Factory Automation Equipment,RBICS_IG,4010201515,40102015
Industrial Machinery and Supplies Distributors,RBICS_IG,Equipment and Supplies Distributors,RBICS_IG,4015201015,40152010
Full-Service Restaurants and Bars,RBICS_IG,Restaurants and Bars,RBICS_IG,1510102510,15101025
Other Personal Services,RBICS_IG,Personal Services,RBICS_IG,5025101515,50251015
Infrastructure Construction,RBICS_IG,Infrastructure Construction/Contracting Services,RBICS_IG,4015251010,40152510
Other Hosting Services,RBICS_IG,Internet Hosting Services,RBICS_IG,5520102020,55201020
Infrastructure Consulting and Design Services,RBICS_IG,Infrastructure Construction/Contracting Services,RBICS_IG,4015251015,40152510
Other Paper Packaging Products Manufacturing,RBICS_IG,Paper Packaging Products,RBICS_IG,4520152020,45201520
Printing and Stationary Paper Products,RBICS_IG,Paper and Paper Products,RBICS_IG,4520102015,45201020
Pulp and Paper Mills,RBICS_IG,Paper and Paper Products,RBICS_IG,4520102020,45201020
Network Design and Implementation Consulting,RBICS_IG,Infrastructure and Network Consulting Services,RBICS_IG,5520202520,55202025
Security and Management Consulting,RBICS_IG,Infrastructure and Network Consulting Services,RBICS_IG,5520202525,55202025
Managed Hosting Services,RBICS_IG,Internet Hosting Services,RBICS_IG,5520102015,55201020
Software Design and Engineering Consulting,RBICS_IG,Infrastructure and Network Consulting Services,RBICS_IG,5520202530,55202025
General Accessories Retail,RBICS_IG,Accessories Retail,RBICS_IG,2025101010,20251010
Alternative Investment Managers,RBICS_IG,Asset Management and Financial Advisory Services,RBICS_IG,3020101010,30201010
Alcoholic Beverage Production,RBICS_IG,Beverages Production,RBICS_IG,5015151010,50151510
General Beverage Production,RBICS_IG,Beverages Production,RBICS_IG,5015151015,50151510
Publishing,RBICS_IG,Print Media and Publishing Services,RBICS_IG,1515102020,15151020
Other Apparel Retail,RBICS_IG,Apparel Retail,RBICS_IG,2025102015,20251020
Limited-Service and Fast Food Restaurants,RBICS_IG,Restaurants and Bars,RBICS_IG,1510102515,15101025
Healthcare and Pharma Industry Software,RBICS_IG,Healthcare Administrative Support Services,RBICS_IG,3515101515,35151015
"Toy, Game, Hobby and Musical Instrument Products",RBICS_IG,Other Leisure Goods,RBICS_IG,2010151035,20101510
Other Entertainment and Programming Providers,RBICS_IG,Entertainment and Programming Providers,RBICS_IG,1515101510,15151015
Other Precious Metal Ore Mining,RBICS_IG,Precious Metal Mining,RBICS_IG,4515252025,45152520
Other Oncology Biopharmaceuticals,RBICS_IG,Oncology Biopharmaceuticals,RBICS_IG,3510101520,35101015
Non-Ferrous Metal Ore Mining,RBICS_IG,Base Metal Mining,RBICS_IG,4515251010,45152510
Other Materials Distributors,RBICS_IG,Materials Distributors,RBICS_IG,4015201515,40152015
Other Gold Mining,RBICS_IG,Precious Metal Mining,RBICS_IG,4515252020,45152520
United States East Savings Institutions,RBICS_IG,United States Savings Institutions,RBICS_IG,3010201510,30102015
Americas Petroleum Refineries,RBICS_IG,Petroleum Refineries,RBICS_IG,2515101510,25151015
"Asphalt, Cement and Concrete Products",RBICS_IG,Heavy Building Material and Aggregate Products,RBICS_IG,4515352010,45153520
Lubricants Manufacturing,RBICS_IG,Other Specialty/Performance Chemical Manufacturing,RBICS_IG,4510203025,45102030
Hospitality Industry Software,RBICS_IG,Accommodation Providers,RBICS_IG,1510101015,15101010
Consumer Vehicle Powertrain and Chassis Makers,RBICS_IG,Consumer Vehicle Parts Manufacturing,RBICS_IG,2020101015,20201010
United States Air Passenger Service Providers,RBICS_IG,Air Passenger Transportation,RBICS_IG,4015301030,40153010
Investment Company,RBICS_IG,Investment Holding Companies,RBICS_IG,3020102035,30201020
Other Small Home Appliances Makers,RBICS_IG,Small Appliances and Accessories Manufacturing,RBICS_IG,5020101530,50201015
Clinical Laboratory Patient Diagnostics,RBICS_IG,Ambulatory and Outpatient Diagnostic Patient Care,RBICS_IG,3515151510,35151515
Multi-Process Assembly Services,RBICS_IG,Contract Electronic Manufacturing,RBICS_IG,5510151015,55101510
Printed Circuit Board/Wiring Board Manufacturing,RBICS_IG,Interconnect Fabrication,RBICS_IG,5510152020,55101520
Internet Entertainment Retail,RBICS_IG,Entertainment Retail,RBICS_IG,2025151520,20251515
Multi-Type Passenger Transportation,RBICS_IG,Other Passenger Transportation,RBICS_IG,4015301515,40153015
Food Delivery Services,RBICS_IG,Other Food and Beverage Services,RBICS_IG,1510102020,15101020
Automotive Equipment Rental,RBICS_IG,Motor Vehicles and Parts Sales and Rental,RBICS_IG,2015102010,20151020
Automobile Dealers,RBICS_IG,Motor Vehicle Sales,RBICS_IG,2015101510,20151015
"Automotive Parts, Accessories and Tires Sales",RBICS_IG,Motor Vehicles and Parts Sales and Rental,RBICS_IG,2015102015,20151020
Viral Infectious Disease Biopharmaceuticals,RBICS_IG,Infectious Disease Biopharmaceuticals,RBICS_IG,3510101020,35101010
Computer Aided Design Software,RBICS_IG,Design and Engineering Software,RBICS_IG,5520151010,55201510
Car Manufacturers,RBICS_IG,Consumer Vehicle Manufacturing,RBICS_IG,2020101510,20201015
"Fruit, Nut and Vegetable Farming",RBICS_IG,Crop Production,RBICS_IG,5015101520,50151015
Industrial Robots and Material Handler Equipment,RBICS_IG,Factory Automation Equipment,RBICS_IG,4010201510,40102015
Handheld/Smart Phone Games Software,RBICS_IG,Games Software,RBICS_IG,5520152015,55201520
Internet Electronics Retail,RBICS_IG,Electronics Retail,RBICS_IG,2025151035,20251510
Africa Banks,RBICS_IG,"Europe, Middle East and Africa Banks",RBICS_IG,3010102010,30101020
Narcotics Pain Management Biopharmaceuticals,RBICS_IG,Pain Management Biopharmaceuticals,RBICS_IG,3510151515,35101515
Veterinary Products,RBICS_IG,Veterinary Products and Services,RBICS_IG,3515203010,35152030
Veterinary Services,RBICS_IG,Veterinary Products and Services,RBICS_IG,3515203015,35152030
Other Games Software,RBICS_IG,Games Software,RBICS_IG,5520152025,55201520
Other Interconnect Components,RBICS_IG,Interconnect Electronic Components,RBICS_IG,5510101020,55101010
Home and Office Productivity Peripherals,RBICS_IG,Computer Peripherals,RBICS_IG,5515201015,55152010
General Metal Parts and Components Makers,RBICS_IG,Metal Parts and Component Manufacturing,RBICS_IG,4515101025,45151010
Building/Physical Electronic Security Equipment,RBICS_IG,Electronic Security Equipment,RBICS_IG,5515101510,55151015
Consumer Batteries Manufacturing,RBICS_IG,Small Appliances and Accessories Manufacturing,RBICS_IG,5020101510,50201015
Other Building Materials and Garden Supply Stores,RBICS_IG,Building Materials and Garden Supply Stores,RBICS_IG,2025201015,20252010
Supermarkets,RBICS_IG,Grocery Stores,RBICS_IG,5010102020,50101020
Central and South America Mixed Telecom Services,RBICS_IG,Pan-Americas Mixed Telecommunications Services,RBICS_IG,6010105015,60101050
Other Automotive Services,RBICS_IG,Automotive Services,RBICS_IG,2015101020,20151010
"Design, Integration and Implementation Consulting",RBICS_IG,Infrastructure and Network Consulting Services,RBICS_IG,5520202510,55202025
Network Infrastructure Software,RBICS_IG,IT Infrastructure Software,RBICS_IG,5520153530,55201535
Information and News Content Providers and Sites,RBICS_IG,Consumer Data and Services,RBICS_IG,5520101010,55201010
Diversified Patient Care,RBICS_IG,Multi-Delivery-Type Patient Care,RBICS_IG,3515152510,35151525
Professional Content Providers,RBICS_IG,Professional Data and Services,RBICS_IG,5520103010,55201030
Fitness and Exercise Equipment,RBICS_IG,Sporting and Athletic Goods,RBICS_IG,2010152010,20101520
General Enterprise Management Software,RBICS_IG,Enterprise Management Software,RBICS_IG,5520151535,55201515
Nutraceuticals,RBICS_IG,Nutritional Health Pharmaceuticals,RBICS_IG,3515201015,35152010
Dietary and Naturopathic Supplements,RBICS_IG,Nutritional Health Pharmaceuticals,RBICS_IG,3515201010,35152010
Web Development Software Makers,RBICS_IG,Internet Hosting Services,RBICS_IG,5520102025,55201020
Apparel Production,RBICS_IG,Apparel and Footwear Production,RBICS_IG,2010101515,20101015
Automobile Comfort/Safety/Electronics Parts Makers,RBICS_IG,Consumer Vehicle Parts Manufacturing,RBICS_IG,2020101010,20201010
Post-Secondary Educational Services,RBICS_IG,Educational Services,RBICS_IG,5025101015,50251010
Cardiology Medical Devices,RBICS_IG,System-Specific General Medical Devices,RBICS_IG,3520151010,35201510
System-Specific Specialized Medical Devices,RBICS_IG,Specialized Medical Devices,RBICS_IG,3520201515,35202015
Other Educational Services,RBICS_IG,Educational Services,RBICS_IG,5025101010,50251010
Genetic Molecular Diagnostic Test Kits,RBICS_IG,Clinical Diagnostics Devices,RBICS_IG,3520101020,35201010
Commercial/Public Service Vehicle Component Makers,RBICS_IG,Commercial Transportation Equipment Manufacturing,RBICS_IG,4010251010,40102510
Pet Supplies Manufacturing,RBICS_IG,Other Leisure Goods,RBICS_IG,2010151025,20101510
Cryptocurrency Mining,RBICS_IG,Consumer Finance Services,RBICS_IG,3030101545,30301015
Bioanalytical Instruments,RBICS_IG,Scientific Products,RBICS_IG,3515202510,35152025
Architectural Component Manufacturing,RBICS_IG,Architectural and Infrastructure Component Makers,RBICS_IG,4515351010,45153510
Primary Care,RBICS_IG,Other Ambulatory and Outpatient Patient Care,RBICS_IG,3515153020,35151530
Pharmacies and Drug Stores,RBICS_IG,Pharmacies and Drug Retailers,RBICS_IG,5010201510,50102015
Analytical and Bioanalytical Services,RBICS_IG,Other Outsourced Biomedical Services,RBICS_IG,3515201510,35152015
Credit Cards,RBICS_IG,Consumer Finance Services,RBICS_IG,3030101520,30301015
General Consumer Finance Services,RBICS_IG,Consumer Finance Services,RBICS_IG,3030101535,30301015
Surgical Devices,RBICS_IG,System-Specific General Medical Devices,RBICS_IG,3520151020,35201510
Biological Specimen Storage,RBICS_IG,Other Healthcare Support Services,RBICS_IG,3515102510,35151025
Government and Not-For-Profit Industry Software,RBICS_IG,Administrative Services,RBICS_IG,1010151020,10101510
US and Canada Natural Gas Pipeline and Storage,RBICS_IG,Natural Gas Pipeline and Storage Services,RBICS_IG,2515151015,25151510
Real Estate Developers,RBICS_IG,Other Real Estate Investment and Services,RBICS_IG,3025151020,30251510
Other Agrochemicals Manufacturing,RBICS_IG,Agrochemical Products,RBICS_IG,4510202015,45102020
Other Chemical Additives Manufacturing,RBICS_IG,Additives Manufacturing,RBICS_IG,4510201020,45102010
Productivity Software,RBICS_IG,Home and Office Software,RBICS_IG,5520152530,55201525
Other Consulting and Business Process Outsourcing,RBICS_IG,Consulting/Business Process Outsourcing Services,RBICS_IG,1010151520,10101515
Internet Department Stores,RBICS_IG,Department Stores,RBICS_IG,5010151030,50101510
United States Wireline Services,RBICS_IG,Wireline Services,RBICS_IG,6010151530,60101515
Oil and Gas Well Drilling,RBICS_IG,Oil and Gas Field Support Activities,RBICS_IG,2510201515,25102015
Europe Wholesale Power,RBICS_IG,Other International Wholesale Power,RBICS_IG,6510105010,65101050
General Discount Stores,RBICS_IG,Discount Stores,RBICS_IG,5010151510,50101515
"Other Arts, Entertainment and Recreation Providers",RBICS_IG,"Arts, Entertainment and Recreation Providers",RBICS_IG,1510101520,15101015
Aviation Equipment,RBICS_IG,Aerospace Equipment,RBICS_IG,4010101010,40101010
Other Support Services,RBICS_IG,Facilities and Other Support Services,RBICS_IG,1010201015,10102010
Dairy and Dairy Alternative Production,RBICS_IG,Food Production,RBICS_IG,5015151515,50151515
Other Enterprise Management Software,RBICS_IG,Enterprise Management Software,RBICS_IG,5520151540,55201515
Personal Loans,RBICS_IG,Consumer Finance Services,RBICS_IG,3030101540,30301015
Diversified Contract Research Organizations,RBICS_IG,Contract Research Organizations,RBICS_IG,3515251520,35152515
Data Storage Drives and Peripherals,RBICS_IG,Data Storage Hardware,RBICS_IG,5515202010,55152020
Other Health Plans,RBICS_IG,Health Plan Providers,RBICS_IG,3515101015,35151010
Healthcare Business Management Services,RBICS_IG,Healthcare Administrative Support Services,RBICS_IG,3515101510,35151015
Other Managed Care,RBICS_IG,Health Plan Providers,RBICS_IG,3515101020,35151010
Other Internet Health and Personal Care Retail,RBICS_IG,Other Health and Personal Care Retail,RBICS_IG,5010201015,50102010
Lumber Processing and Sawmill Products,RBICS_IG,Construction Wood Products,RBICS_IG,4520101015,45201010
Engineered Wood Products Manufacturing,RBICS_IG,Construction Wood Products,RBICS_IG,4520101010,45201010
